text,intent
天佑德青稞酒公司是专业酒类生产厂家吗,knowledge_query
青稞酒酿造要求哪些原料,knowledge_query
老白干香型的酿造工艺是怎样的,knowledge_query
青稞和小麦有什么区别？,knowledge_query
青稞一般在哪些地方种植？,knowledge_query
青稞为什么种植在青藏高原？,knowledge_query
青稞的健康价值如何？,knowledge_query
青稞酒相比高粱酒有什么特点？,knowledge_query
酿青稞酒的水有什么特别之处？,knowledge_query
天佑德青稞种植基地通过有机认证了吗？,knowledge_query
天佑德青稞酒用到了哪些青稞品种？,knowledge_query
稀有青稞品种的种植情况如何？,knowledge_query
为什么互助地区适合酿造青稞酒？,knowledge_query
天佑德青稞酒公司的酿酒原料来自哪里？,knowledge_query
江南大学的培养优秀品质和技能的方式是怎样的,knowledge_query
天佑德酒青稞酒怎样,knowledge_query
原子城位于何处,knowledge_query
三木德是谁一个有趣的人物有什么故事他的生活充满了冒险和奇遇,knowledge_query
豉香型白酒的口感特点是什么,knowledge_query
青稞酒可以勾兑吗,knowledge_query
东和乡麻吉村油嘴湾花海农庄所在地,knowledge_query
减少大气酸化及其对环境的负面影响,knowledge_query
北山动植物有哪些种类,knowledge_query
酿酒细菌的功能是什么,knowledge_query
豉香型白酒的曲是什么,knowledge_query
制作馥郁香型白酒有什么特点,knowledge_query
九天保是谁,knowledge_query
老白干香型白酒的工艺特点传统浓郁独特香味,knowledge_query
老白干与其他白酒香型有何不同,knowledge_query
国家地理标志产品的定义是什么,knowledge_query
浓香型白酒分类,knowledge_query
红四星产品简介,knowledge_query
酒为何需陈藏,knowledge_query
青稞酒文学资料有哪些,knowledge_query
互助青稞酒是否国家地理标志产品依据何在,knowledge_query
青藏高原非常神奇吗,knowledge_query
凤香型白酒的酿造原料是什么,knowledge_query
凤香型白酒特征是什么,knowledge_query
芝麻香型白酒的发酵窖池特点是什么,knowledge_query
天佑德如何开创美好未来,knowledge_query
互助地区环境适宜酿造青稞酒,knowledge_query
西藏旅行有什么建议,knowledge_query
You know anyone from Tianyoude,knowledge_query
青稞酒的酿造工艺可以告诉我吗,knowledge_query
浓香型白酒的香气特点是什么,knowledge_query
新酒与老酒的区别,knowledge_query
请介绍一下李银会,knowledge_query
看花摘酒是一种欣赏花朵和品尝美酒的活动,knowledge_query
青稞酒受欢迎原因是什么,knowledge_query
德青稞酒原始检测记录存储期限是多久,knowledge_query
你和李银有什么有趣故事,knowledge_query
介绍一下青稞酒好吗,knowledge_query
你们公司的老板是谁,knowledge_query
卓扎滩原生态景区的地理位置和娱乐项目是什么,knowledge_query
天佑德青稞酒的特点有哪些,knowledge_query
互助土族妇女服饰颜色,knowledge_query
定义米香型白酒,knowledge_query
你可以介绍一下李银会吗,knowledge_query
我想了解充分青稞酒的酿造,knowledge_query
青藏铁路,knowledge_query
“青稞酒”的“青”和“黄”是什么意思？,knowledge_query
你能给我介绍一下八大作坊吗？,knowledge_query
你能给我介绍一下世义德吗？,knowledge_query
世义德散酒六大安全保障措施都是什么？,knowledge_query
青海湖,knowledge_query
你能给我介绍一下永庆和吗？,knowledge_query
你能给我介绍一下互助牌青稞酒吗？,knowledge_query
你能给我介绍一下零号酒样吗？,knowledge_query
互助土族盘绣是什么？,knowledge_query
介绍一下徐岩,knowledge_query
宋书玉是谁,knowledge_query
互助县鼓楼简介,knowledge_query
介绍T5D青稞酒产品,knowledge_query
青稞酒的产地,knowledge_query
李银会严肃时表现如何,knowledge_query
青稞酒是怎么酿造的？,knowledge_query
北山公园的景区有哪些,knowledge_query
天佑德青稞酒的产品结构是怎样的,knowledge_query
清蒸/清烧和天酿工艺有何区别,knowledge_query
qinghai历史文化,knowledge_query
天佑德青稞酒公司的企业原则是什么？,knowledge_query
天佑德青稞酒公司员工行为准则是什么？,knowledge_query
三江源是指什么？,knowledge_query
关于昆仑山的神话与文化,knowledge_query
西部土族民俗文化村在哪里？,knowledge_query
什么是山南地区,knowledge_query
天佑德青稞酒公司的员工信仰是什么？,knowledge_query
天佑德青稞酒公司企业文化中青稞信仰如何理解？,knowledge_query
天佑德青稞酒公司企业文化中青稞酒信仰如何理解？,knowledge_query
互助土族传统节日,knowledge_query
天佑德青稞酒公司企业文化中天佑德青稞酒信仰如何理解？,knowledge_query
青海省著名景点,knowledge_query
青稞酒的口感如何？,knowledge_query
北山互助圣母天池简介,knowledge_query
酒精含量高导致醉酒,knowledge_query
青稞酒含酒精度数高吗？,knowledge_query
青稞酒有哪些品牌？,knowledge_query
两干一湿在蒸酒过程中的含义,knowledge_query
青稞酒的历史悠久吗？,knowledge_query
天佑德合作单位有哪些,knowledge_query
喝青稞酒有什么讲究？,knowledge_query
天佑德公司是上市公司吗？,knowledge_query
天佑德公司到底有几个，为什么互助、西宁、西藏都有天佑德的身影？,knowledge_query
市面上有一些酒企在仿冒你们的产品或者包装，对一些消费者造成误解，对此您怎么看？,knowledge_query
天佑德未来的发展目标是什么？,knowledge_query
听说天佑德旗下还有青稞产业园项目，是干什么的？,knowledge_query
中国青稞酒研究院的由来？,knowledge_query
天佑德青稞酒公司的内部培训机构叫什么？,knowledge_query
天佑德青稞酒产品结构大致是什么？,knowledge_query
互助青稞酒和天佑德青稞酒有什么关系吗？,knowledge_query
青稞酒怎么喝才好喝？,knowledge_query
青稞酒温酒的原因是什么,knowledge_query
怎么才能温酒呢？,knowledge_query
藏族习俗,knowledge_query
喝青稞酒有什么好处吗？,knowledge_query
青稞中的健康成分会进入到青稞酒中吗？,knowledge_query
青稞酒有哪些品牌？,knowledge_query
天佑德存酒都有什么容器，分别有什么特点？,knowledge_query
介绍一下天佑德青稞酒包装车间大致情况？,knowledge_query
什么是酒海，酒海有什么特点？,knowledge_query
在白酒生产过程中，陶坛是干什么用的？,knowledge_query
介绍土火锅,knowledge_query
在白酒企业中，不锈钢罐用来储酒好吗？,knowledge_query
天佑德青稞酒的生产工艺有什么特色？,knowledge_query
喝青稞酒有什么讲究？,knowledge_query
酿酒的关键微生物是哪些,knowledge_query
介绍一下小黑,knowledge_query
青稞酒适合什么场合？,knowledge_query
青稞酒加水会变浑浊吗,knowledge_query
青稞酒能长时间保存吗？,knowledge_query
天佑德的未来发展目标是什么,knowledge_query
青稞酒和米酒区别大吗？,knowledge_query
青稞酒的产地在哪里？,knowledge_query
青稞酒的价格范围？,knowledge_query
青稞酒适合搭配什么食物？,knowledge_query
青稞酒的营养价值高吗？,knowledge_query
青稞酒有药用价值吗？,knowledge_query
青稞酒的最佳饮用温度？,knowledge_query
6大安全保障措施有哪些,knowledge_query
青稞酒的保质期是多久？,knowledge_query
天佑德对行业影响大吗,knowledge_query
青稞酒的酿造工艺复杂吗？,knowledge_query
清香型白酒的酿造原料是什么？,knowledge_query
清香型白酒的酒精度数是多少？,knowledge_query
清香型白酒的产地有哪些？,knowledge_query
清香型白酒的色泽是什么样的？,knowledge_query
清香型白酒有哪些特点？,knowledge_query
清香型白酒与其他类型的白酒有何不同？,knowledge_query
清香型白酒的酒窖有何特点？,knowledge_query
清香型白酒的市场表现如何？,knowledge_query
药香型白酒代表及产地？,knowledge_query
青稞酒有无添加剂吗？,knowledge_query
药香型白酒酿酒原料？,knowledge_query
药香型白酒酿造工艺？,knowledge_query
什么是药香型白酒串蒸工艺？,knowledge_query
药香型白酒酿造特点？,knowledge_query
药香型白酒与药酒的区别？,knowledge_query
药香型白酒成分？,knowledge_query
什么是米香型白酒？,knowledge_query
米香型白酒的代表产品有哪些？,knowledge_query
米香型白酒的特点有哪些？,knowledge_query
米香型白酒的主要原料、用水？,knowledge_query
米香型白酒的生产工艺？,knowledge_query
你有推荐哪些好酒,knowledge_query
青稞酒的文化意义是？,knowledge_query
纯粮固态发酵法与固液法结合法酿酒的差异及区分方法,knowledge_query
青稞酒的后味如何,knowledge_query
浓香型白酒的定义,knowledge_query
李灵儿是怎么了解到天佑德这个品牌的,knowledge_query
精选优质青稞,knowledge_query
豉香型白酒的口感？,knowledge_query
豉香型白酒的代表？,knowledge_query
馥郁香型白酒代表产品？,knowledge_query
馥郁香型白酒的工艺特点？,knowledge_query
馥郁香型白酒酿造原料及特点？,knowledge_query
馥郁香型白酒是用什么曲酿造？,knowledge_query
馥郁香型白酒发酵设备特点？,knowledge_query
馥郁香型白酒采用什么酿造工艺？,knowledge_query
天佑德主要销售什么产品？,knowledge_query
馥郁香型白酒用何曲酿造,knowledge_query
八大作坊,knowledge_query
请问关于青稞酒有什么问题,knowledge_query
天佑德青稞酒企业核心价值观是什么,knowledge_query
十二盘的由来是什么,knowledge_query
青稞酒信仰是天佑德青稞酒公司的核心文化,knowledge_query
青稞酒需要加糠皮来酿制,knowledge_query
青稞酒的酿造水源在哪里,knowledge_query
天佑德青稞酒公司的内部培训机构叫什么,knowledge_query
天佑德品牌的创始人是谁？,knowledge_query
请问哪儿有卖,knowledge_query
青稞酒温酒形成因素是什么,knowledge_query
请介绍一下天佑德青稞酒公司,knowledge_query
天佑德的目标是什么,knowledge_query
白酒为何使人头晕,knowledge_query
青稞酒含酒精吗,knowledge_query
白酒酿造原料和特点是什么,knowledge_query
天佑德的品牌理念是什么？,knowledge_query
你在那里学到了哪些东西,knowledge_query
特曲头曲二曲大曲小曲是什么种类的酒,knowledge_query
价位决定青稞酒的口味差异,knowledge_query
青稞酒是国家非遗吗,knowledge_query
蒸馏是提取纯净液体的过程,knowledge_query
天佑德青稞酒信仰解析,knowledge_query
天佑德的产品线有哪些？,knowledge_query
布达拉宫简介,knowledge_query
大昭寺简介,knowledge_query
小昭寺简介,knowledge_query
扎基寺简介,knowledge_query
哲蚌寺简介,knowledge_query
色拉寺简介,knowledge_query
甘丹寺简介,knowledge_query
扎什伦布寺简介,knowledge_query
萨迦寺简介,knowledge_query
天酿工艺的定义是什么,knowledge_query
适合储存白酒的不锈钢罐吗,knowledge_query
绒布寺简介,knowledge_query
桑耶寺简介,knowledge_query
什么是藏族的象雄文化？,knowledge_query
藏族的丧葬习俗,knowledge_query
藏族的饮食习惯,knowledge_query
藏族的民族禁忌,knowledge_query
藏族的服饰特色,knowledge_query
藏族的藏袍特色,knowledge_query
藏族的服装装饰都有哪些？,knowledge_query
献哈达,knowledge_query
西藏的饮酒饮食习惯,knowledge_query
青稞助学计划是什么,knowledge_query
天佑德品牌成立多久了？,knowledge_query
天佑德青稞酒的主要品牌是什么,knowledge_query
青海有什么特色手工艺品？,knowledge_query
青海的夜空值得观赏吗？,knowledge_query
青海有哪些户外活动？,knowledge_query
青海的高原反应严重吗？,knowledge_query
青海的旅游费用大概多少？,knowledge_query
青海的旅游景点有哪些？,knowledge_query
天佑德的市场定位如何？,knowledge_query
天佑德青稞酒公司的目标是什么,knowledge_query
天佑德品牌的核心竞争力？,knowledge_query
青海互助县情况概述,knowledge_query
天佑德青稞酒公司的业务是什么,knowledge_query
金禅酒祖身份和故事是什么,knowledge_query
天佑德青稞酒购买建议,knowledge_query
青海湖的最佳观光季节是什么时候？,knowledge_query
去青海自驾游有什么建议吗？,knowledge_query
青海的天空之境在哪里？,knowledge_query
我该如何规划青海的行程？,knowledge_query
白酒的生产流程是什么,knowledge_query
感兴趣的珍藏酒年份和口感了解吗,knowledge_query
德青稞酒酿造窖池数量及每窖投料量,knowledge_query
天佑德的用户评价怎样？,knowledge_query
大曲是一种中国传统的发酵食品,knowledge_query
天佑德品牌的设计风格？,knowledge_query
香型酿造工艺是如何产生芝麻香味的,knowledge_query
CNAS认可对公司检测中心的意义是什么,knowledge_query
世义德与其他散酒的区别是什么,knowledge_query
介绍家之德产品,knowledge_query
天佑德品牌的发展战略是？,knowledge_query
天佑德的售后服务怎么样？,knowledge_query
天佑德的价格区间是多少？,knowledge_query
购买天佑德青稞酒的建议,knowledge_query
获荣誉天佑德酒检测中心,knowledge_query
塔尔寺简介,knowledge_query
塔尔寺艺术三绝？,knowledge_query
塔尔寺八宝如意塔及简介,knowledge_query
塔尔寺大金瓦殿简介,knowledge_query
青藏高原上的明故宫——瞿昙寺,knowledge_query
被誉为“湟水北岸诸寺之母”——佑宁寺,knowledge_query
文成公主庙,knowledge_query
最佳饮用方式,knowledge_query
青稞酒品牌有哪些,knowledge_query
老白干的代表产品是香型白酒,knowledge_query
天佑德有无环保认证？,knowledge_query
天佑德的产品质量如何？,knowledge_query
青海的藏族文化体验怎么样？,knowledge_query
青海旅游的最佳路线是什么？,knowledge_query
去青海需要特别准备什么吗？,knowledge_query
青海的住宿条件怎么样？,knowledge_query
高度白酒比低度白酒质量好吗,knowledge_query
有什么酒品推荐吗,knowledge_query
天佑德青稞酒厂每年要用掉多少青稞？,knowledge_query
天佑德青稞酒产品质量有保障吗？,knowledge_query
听说天佑德酒厂是国家5A级旅游景区？,knowledge_query
天佑德青稞酒的酿酒规模有多大？,knowledge_query
说一下互助土族传统服饰,knowledge_query
安昭舞是什么？,knowledge_query
你能给我介绍一下家之德产品吗？,knowledge_query
你能给我介绍一下人之德产品吗？,knowledge_query
杰桑·索南达杰的故事,knowledge_query
日喀则是？,knowledge_query
介绍一下纳顿庄园,knowledge_query
你能给我介绍一下T5D青稞酒产品吗？,knowledge_query
你能给我介绍一下七彩互助青稞酒吗？,knowledge_query
祁连黄蘑菇,knowledge_query
你能给我说一下产品价格吗？,knowledge_query
白酒酿造到底是怎么一回事？,knowledge_query
为什么天佑德青稞酒用青稞酿酒，就不能用燕麦或者荞麦酿酒吗？,knowledge_query
青稞在种植的时候有个节日叫什么？,knowledge_query
开耕节在什么地方举行？,knowledge_query
在开耕节那天人们会干什么？,knowledge_query
青稞丰收的节日是什么？,knowledge_query
金银滩景区介绍,knowledge_query
青稞酒搭配哪些菜,knowledge_query
天佑德技术中心专委会的作用是什么,knowledge_query
天佑德有线上商城吗？,knowledge_query
青海有哪些著名的寺庙？,knowledge_query
青海的气候条件如何？,knowledge_query
青海旅游安全吗？,knowledge_query
青海的交通便利吗？,knowledge_query
天佑德的广告口号是什么？,knowledge_query
茶卡盐湖为什么被誉为天空之境？,knowledge_query
茶卡盐湖哪年对外开放？,knowledge_query
茶卡盐湖盐度最高的季节和原因？,knowledge_query
茶卡盐湖形成的原因？,knowledge_query
茶卡盐湖是最大的盐湖吗？,knowledge_query
班彦村扶贫产业都有哪些？,knowledge_query
班彦村什么时候被评为全国脱贫攻坚楷模的？,knowledge_query
班彦村村民如何通过盘绣致富？,knowledge_query
班彦村如何是红色景区？,knowledge_query
佑宁寺简介。,knowledge_query
佑宁寺建筑风格。,knowledge_query
佑宁寺因什么而闻名？,knowledge_query
发酵效果出色,knowledge_query
佑宁寺有多少间经堂？,knowledge_query
佑宁寺周边环境。,knowledge_query
班彦村村史馆主要介绍了什么？,knowledge_query
青海湖的气候特征有哪些？,knowledge_query
青海湖的地理位置？,knowledge_query
青海湖的名称起源？,knowledge_query
青海湖中的5个湖内岛屿有哪些？,knowledge_query
青海湖环湖及周边主要景点有哪些？,knowledge_query
原子城的地理位置？,knowledge_query
原子城的历史文化意义是什么？,knowledge_query
青稞酒的酿造过程介绍一下,knowledge_query
青海的民族节庆有哪些？,knowledge_query
青海湖人口概况？,knowledge_query
青海湖的交通概况？,knowledge_query
卓扎滩原生态景区的地理位置及娱乐项目有哪些？,knowledge_query
卓扎滩原生态景区何时被评为“全国乡村旅游重点村”？,knowledge_query
东和乡麻吉村油嘴湾花海农庄的地理位置？,knowledge_query
油嘴湾花海的简介？,knowledge_query
油嘴湾花海农庄的的接待量如何？,knowledge_query
青海发展旅游的“一圈三线”指什么,knowledge_query
青海十大特产,knowledge_query
青海5A级旅游景区有哪些？,knowledge_query
青海的野生动物园值得去吗？,knowledge_query
标签配料表中物料排列是否随意或规定,knowledge_query
请介绍一下红五星产品,knowledge_query
白酒与药酒的区别是香味,knowledge_query
浓兼酱白酒工艺简介,knowledge_query
酒精浓度与酿造方法的关系,knowledge_query
浓兼酱白酒的酿造和工艺步骤,knowledge_query
上市年份及股票代码是什么,knowledge_query
糖化淀粉转化为糖,knowledge_query
班彦村被评为全国楷模的时间是什么时候,knowledge_query
油嘴湾花海是什么,knowledge_query
白酒生产中陶坛的作用是什么,knowledge_query
陶坛在白酒生产中的用途是什么,knowledge_query
陶坛在白酒制造中的功能是什么,knowledge_query
最大的盐湖是茶卡盐湖吗,knowledge_query
茶卡盐湖最高盐度季节夏季原因高温蒸发水分流失,knowledge_query
适合什么场合饮用,knowledge_query
凤香型白酒起源与文化,knowledge_query
香气浓郁,knowledge_query
茅台镇是茅台酒的产地,knowledge_query
区分新酒和老酒的方法是什么,knowledge_query
虚拟人功能是什么,knowledge_query
设计者是谷歌研发团队我是AI助手,knowledge_query
天佑德青稞酒检测入窖指标发酵情况,knowledge_query
芝麻香型白酒发酵窖池是什么,knowledge_query
青稞酒包含青稞健康成分吗,knowledge_query
虚拟人的最大优势是灵活性和可定制性,knowledge_query
开发者是谁,knowledge_query
什么是实验室分类,knowledge_query
第一第二第三方实验室的定义,knowledge_query
实验室分类依据是什么,knowledge_query
分别解释第一方第二方和第三方实验室,knowledge_query
你的名字和身份是什么,knowledge_query
企业投资建设酒糟场,knowledge_query
青海湖的人口情况,knowledge_query
请告诉我更多青稞酒信息,knowledge_query
北山国家森林公园面积多大,knowledge_query
天佑德存酒的容器和特点是什么,knowledge_query
天佑德青稞酒的特点是什么,knowledge_query
酱香型白酒按其生产工艺分为哪几个类型？,knowledge_query
茅台酒的十大工艺特点？,knowledge_query
什么是浓香型白酒？,knowledge_query
浓香型白酒香气特点？,knowledge_query
浓香型白酒的酿造工艺？,knowledge_query
浓香型白酒代表品牌？,knowledge_query
浓香型白酒的风格特点？,knowledge_query
什么是单粮型浓香型白酒？,knowledge_query
什么是多粮型浓香型白酒？,knowledge_query
什么是清香型白酒？,knowledge_query
介绍永庆和,knowledge_query
什么是大曲？,knowledge_query
大曲和小曲有啥区别？,knowledge_query
天佑德为啥要使用大曲而不用小曲？,knowledge_query
天佑德青稞酒使用的大曲有什么特点？,knowledge_query
什么是白霜满天星曲？,knowledge_query
什么是槐瓤曲？,knowledge_query
青稞酒中白霜满天星曲和槐瓤曲为什么要配合起来使用？,knowledge_query
青稞酒大曲中豌豆有什么作用？,knowledge_query
天佑德大曲为啥要用青稞和豌豆，而不用小麦或者大麦？,knowledge_query
九天保,knowledge_query
天佑德青稞酒企业文化的青稞精神是什么,knowledge_query
凤香型白酒标准是怎样,knowledge_query
天佑德青稞基地有机认证了吗,knowledge_query
天佑德的大曲是自己做的吗？,knowledge_query
天佑德使用的大曲和其他白酒的大曲配方上有什么区别？,knowledge_query
大曲质量如何控制？,knowledge_query
青稞酒酿造的微生物有什么作用？,knowledge_query
青稞酒酿造微生物在青稞酒酿造过程的主要作用有哪些？,knowledge_query
与酿酒有关的酵母菌有什么作用？,knowledge_query
与酿酒有关的霉菌有什么作用？,knowledge_query
与酿酒有关的细菌有什么作用？,knowledge_query
青稞酒的酿酒微生物有什么特点？,knowledge_query
什么是“天酿工艺”？,knowledge_query
青稞清香白酒特点介绍,knowledge_query
佑宁寺的风格,knowledge_query
张大工是做什么的,knowledge_query
清香型白酒是一种香气纯净清爽怡人的白酒,knowledge_query
系统是否有安全措施,knowledge_query
土族与土家族的区别是什么,knowledge_query
张大工,knowledge_query
清香型白酒与其他白酒有何不同,knowledge_query
纯粮酿造并不代表一定是好酒,knowledge_query
酱香型白酒代表产品有哪些,knowledge_query
游泳方法关键是什么能给些具体建议吗,knowledge_query
期待与你一同探索青稞酒之旅,knowledge_query
请问贵公司的特色产品是什么,knowledge_query
关于天佑德青稞酒公司信息,knowledge_query
酒原料源自何处,knowledge_query
天佑德青稞酒有什么产品推荐,knowledge_query
天佑德青稞酒有哪些推荐产品,knowledge_query
请推荐一下天佑德青稞酒的产品,knowledge_query
采用了哪些青稞种植品种,knowledge_query
佑宁寺以何闻名,knowledge_query
推荐购买“国之德·真年份6年”,knowledge_query
介绍天佑德青稞酒公司的信息,knowledge_query
产品价格可以告诉我价钱吗,knowledge_query
什么是岩木合一？,knowledge_query
什么是天人合一？,knowledge_query
酿造车间是怎样设计的？,knowledge_query
酒是被发现的，还是被发明的？,knowledge_query
纯粮固态发酵法和固液法、结合法酿的酒有什么不同？,knowledge_query
介绍一下青海湖,knowledge_query
固态法白酒是什么意思？,knowledge_query
液态法白酒是什么意思？,knowledge_query
天佑德的品牌话术,knowledge_query
尕面片是什么食物,knowledge_query
固液法白酒是什么意思？,knowledge_query
天佑德青稞酒装甑操作原则是什么,knowledge_query
“天酿工艺”生产的青稞酒有何区别？,knowledge_query
什么是“清蒸清烧四次清”？,knowledge_query
听说汾酒采用“清蒸清烧二次清”工艺，天佑德为什么不学汾酒？,knowledge_query
为什么青稞酒不采用混蒸混烧工艺？,knowledge_query
为什么青稞酒酿酒过程中要加糠皮（谷壳）？,knowledge_query
天佑德青稞酒为什么要用花岗岩窖池？,knowledge_query
为什么青稞酒窖池底部要铺一层松木板？,knowledge_query
青稞酒发酵要用多少天？,knowledge_query
青稞酒为什么要采用低温入窖？,knowledge_query
天佑德在酿造过程中为什么要遵循“稳、准、细、净”的工艺原则？,knowledge_query
发酵过程中什么是“前缓、中挺、后缓落”？,knowledge_query
什么是发酵？,knowledge_query
天佑德品牌成立有多少时间,knowledge_query
天佑德有多久,knowledge_query
天佑德葡萄酒系列产品介绍,knowledge_query
北山的互助有什么独特优势,knowledge_query
天佑德的成立时间,knowledge_query
青稞酒是白酒,knowledge_query
海拔2800,knowledge_query
天之德,knowledge_query
国之德,knowledge_query
家之德,knowledge_query
人之德,knowledge_query
第三代金标,knowledge_query
第三代银标,knowledge_query
天佑德青稞酒福酒F6,knowledge_query
天佑德青稞酒福酒F8,knowledge_query
天佑德青稞酒福酒F9,knowledge_query
清香白酒产地哪些,knowledge_query
什么是蒸馏？,knowledge_query
蒸酒过程中什么是“两小一大”？,knowledge_query
请介绍一下中国白酒的香型,knowledge_query
请介绍下世界美酒特色产区,knowledge_query
天佑德青稞酒好喝吗？,knowledge_query
青海有哪些著名的景区,knowledge_query
介绍一下阿拉嘉宝青稞酒的情况,knowledge_query
介绍一下西藏阿拉嘉宝青稞酒业有限责任公司发展情况,knowledge_query
介绍一下西藏阿拉嘉宝青稞酒业有限责任公司在社会责任方面相关情况,knowledge_query
天佑德青稞酒干部文化“八管”是什么意思？,knowledge_query
