text,intent
Features of Tianyoude Highland Barley Liquor,knowledge_query
液态白酒指的是以液体形式生产的白酒,knowledge_query
青稞酒是否有保质期,knowledge_query
青稞酒的特殊喝酒仪式是什么,knowledge_query
希望品尝传统的美酒,knowledge_query
赵充国是谁,knowledge_query
赵充国的故事是什么,knowledge_query
开耕节地点 15 字以内无法做到简洁表达,knowledge_query
米香型白酒生产方法,knowledge_query
互助县美丽吗是否在青稞田诞生,knowledge_query
推荐几个天佑德产品,knowledge_query
青稞酒总共经过多少道检验,knowledge_query
清香白酒的酒精度数是,knowledge_query
凤香型白酒产地,knowledge_query
互助县美丽吗市场部的挑战是什么,knowledge_query
区别在制作工艺和产品口感上,knowledge_query
青海湖的名称起源是什么,knowledge_query
“天酿工艺”青稞酒的特点是什么,knowledge_query
天佑德的酿造工艺的创造来源,knowledge_query
天佑德青稞酒对青海的贡献有哪些,knowledge_query
豉香型白酒代表是哪一种,knowledge_query
兼香型白酒的大曲是什么,knowledge_query
青稞酒酿造微生物的主要作用是什么,knowledge_query
正确评价青稞酒的方法有哪些,knowledge_query
阿咪东索,knowledge_query
格日勒特,knowledge_query
格日勒特是谁？,knowledge_query
介绍小庄土族民俗文化村,knowledge_query
小庄土族文化,knowledge_query
讲解天佑德,knowledge_query
青稞酒相关歌曲,knowledge_query
九天保是谁？,knowledge_query
三木德是谁？,knowledge_query
天佑德Logo释义,knowledge_query
赵长基是谁？,knowledge_query
天佑德为何选择大曲而非小曲,knowledge_query
AI数字虚拟人的美酒推荐如何实现,knowledge_query
天佑德与其他白酒,knowledge_query
大曲配方有何不同,knowledge_query
凤香型白酒制曲原料是什么,knowledge_query
八宝如意塔是什么？,knowledge_query
孙宝国,knowledge_query
青海藏红花是什么样的,knowledge_query
介绍青藏公路,knowledge_query
你能给我介绍一下出口型吗？,knowledge_query
西藏茶文化,knowledge_query
藏红花有什么用,knowledge_query
土族有什么忌讳,knowledge_query
彩虹部落土族园,knowledge_query
你能给我介绍一下红四星产品吗？,knowledge_query
互助土族民俗有些什么吗？,knowledge_query
你能给我介绍一下红五星产品吗？,knowledge_query
茶卡盐是什么东西,knowledge_query
什么是扎基寺,knowledge_query
冬虫夏草,knowledge_query
干部文化“八管”,knowledge_query
互助土族盘绣,knowledge_query
你能给我介绍一下小黑吗？,knowledge_query
你能给我介绍一下福酒吗？,knowledge_query
你能给我介绍一下金宝、天宝产品吗？,knowledge_query
你能给我介绍一下海拔系列吗？,knowledge_query
天佑德公益文化,knowledge_query
晒大佛是什么意思？,knowledge_query
互助土族风俗习惯有哪些,knowledge_query
张五九,knowledge_query
介绍南迦巴瓦峰,knowledge_query
介绍一下西藏的人文文化,knowledge_query
天佑德青稞酒获奖情况,knowledge_query
青海湖5个岛屿是哪些,knowledge_query
酱香白酒的特点是风格,knowledge_query
青稞酒的曲香味来自哪里,knowledge_query
互助青稞酒和天佑德青稞酒是否相关,knowledge_query
口感醇厚,knowledge_query
药香型白酒的工艺是什么,knowledge_query
酱香型白酒酿造原料高粱小麦糯米水,knowledge_query
推荐酒的方法和特别推荐,knowledge_query
请给我讲讲青稞酒的历史,knowledge_query
推荐高端青稞酒/500元以上,knowledge_query
青海互助产区为何举世闻名美酒,knowledge_query
天佑德青稞酒厂的文物保护原因,knowledge_query
天佑德酒厂是国家5A级旅游景区吗,knowledge_query
适合在青藏高原种植,knowledge_query
青稞酒是一种令人感兴趣的酒,knowledge_query
兼香型白酒的口感特点是什么,knowledge_query
介绍世义德,knowledge_query
青海湖的气候特征寒冷干燥多风降水稀少,knowledge_query
青稞酒酿造微生物的作用是什么,knowledge_query
青稞酒检测到的微量成分有哪些,knowledge_query
班彦村村史馆介绍村庄历史,knowledge_query
卓扎滩原生态景区评为“全国乡村旅游重点村”的时间是,knowledge_query
青稞有何健康益处,knowledge_query
天佑德青稞酒公司的企业文化关注质量传承青稞文化,knowledge_query
芝麻香型白酒加小麦和麸皮的原因是,knowledge_query
佑宁寺周边的环境如何,knowledge_query
青稞酒发酵所需时间是多久,knowledge_query
如何调经典青稞鸡尾酒,knowledge_query
推荐100-500元的中档青稞酒吗,knowledge_query
豉香型白酒制作步骤,knowledge_query
多粮型浓香型白酒的定义是什么,knowledge_query
天佑德青稞酒公司的主要品牌有哪些？,knowledge_query
藏族的饮食文化,knowledge_query
天佑德的酿造工艺是自主创造还是从外地传过来的？,knowledge_query
青海特产,knowledge_query
天佑德青稞酒历史上，“一祖十贤”是什么意思？,knowledge_query
天佑德名称的具体含义？,knowledge_query
讲一讲昆仑山,knowledge_query
讲一讲藏族文化,knowledge_query
天佑德青稞酒作为本土企业为青海做出的贡献有哪些？,knowledge_query
天佑德青稞酒在公益方面，都有哪些投入和案例？,knowledge_query
什么叫门源青稞,knowledge_query
天佑德“青稞助学行动”是怎么回事？,knowledge_query
天佑德青稞酒为什么不直接勾调出厂,knowledge_query
白酒适量不伤身体,knowledge_query
介绍零号酒样,knowledge_query
我是OpenAI开发的ChatGPT,knowledge_query
介绍互助牌青稞酒,knowledge_query
选择天佑德大曲用青稞和豌豆的原因是什么,knowledge_query
请介绍天佑德青稞酒的历史和特色,knowledge_query
天佑德技术中心专家数量,knowledge_query
你和李银之间的有趣故事是什么,knowledge_query
如何制作青稞鸡尾酒,knowledge_query
请告诉我关于元宇宙的更多信息,knowledge_query
九天保是谁,knowledge_query
九天保故事九天保有什么故事/他的故事是什么,knowledge_query
哪里能买到这个诱人的东西,knowledge_query
请介绍天佑德青稞酒公司的故事,knowledge_query
温酒方法和技巧,knowledge_query
青稞酒有哪些品种,knowledge_query
青稞酒的特点是什么,knowledge_query
他认真的时候是什么样子,knowledge_query
喜欢的工作探索新酿酒技术,knowledge_query
德青稞酒公司如何理解青藏文化信仰,knowledge_query
天佑德青稞酒原酒储量目前有多少,knowledge_query
酒公司管理战略和教育阶段意义是什么,knowledge_query
槐瓤曲的定义是什么,knowledge_query
区分真假酒的方法是什么,knowledge_query
请告知天佑德购买详细信息,knowledge_query
天佑德青稞酒的特色,knowledge_query
酒海是什么特点是什么,knowledge_query
青海湖在哪里,knowledge_query
合一粮食是指将曲艺和粮食结合在一起,knowledge_query
你是谁,knowledge_query
天佑德旗下的青稞产业园项目是做什么的,knowledge_query
天佑德青稞酒公司的主要品牌有哪些？,knowledge_query
藏族的饮食文化,knowledge_query
天佑德的酿造工艺是自主创造还是从外地传过来的？,knowledge_query
青海特产,knowledge_query
天佑德青稞酒历史上，“一祖十贤”是什么意思？,knowledge_query
天佑德名称的具体含义？,knowledge_query
讲一讲昆仑山,knowledge_query
讲一讲藏族文化,knowledge_query
天佑德青稞酒作为本土企业为青海做出的贡献有哪些？,knowledge_query
天佑德青稞酒在公益方面，都有哪些投入和案例？,knowledge_query
什么叫门源青稞,knowledge_query
天佑德“青稞助学行动”是怎么回事？,knowledge_query
班彦村的扶贫产业有哪些,knowledge_query
酱香型白酒储存的容器有哪些,knowledge_query
青稞酒独特优势是什么,knowledge_query
互助县区有哪些寺庙,knowledge_query
好酒,knowledge_query
你对青稞酒了解很多吗,knowledge_query
天佑德青稞酒公司的员工信仰信任自然纯净,knowledge_query
青海湖景点有哪些,knowledge_query
介绍天佑德青稞酒公司,knowledge_query
豉香白酒用何容器发酵,knowledge_query
贮存老白干香型白酒的容器是什么,knowledge_query
天佑德代表的产品是什么,knowledge_query
购买天佑德青稞酒的方式,knowledge_query
如何购买天佑德青稞酒,knowledge_query
口感纯净,knowledge_query
介绍人之德产品,knowledge_query
原浆酒是指未经加工的纯果汁发酵而成的酒,knowledge_query
最喜欢的事情是什么,knowledge_query
