text,intent
蒸酒过程中什么是“两干一湿”？,knowledge_query
天佑德青稞酒在装甑操作中遵循的六字原则是什么？,knowledge_query
“缓气流酒、大汽追尾”的作用是什么？,knowledge_query
为什么要进行“大气排酸”？,knowledge_query
什么是看花摘酒？,knowledge_query
天佑德青稞酒酿造窖池一共有多少个？,knowledge_query
天佑德青稞酒原酒为什么不直接勾调出厂？,knowledge_query
青稞原酒为什么要进行陈藏？,knowledge_query
原酒是不是贮存时间越长酒越好？,knowledge_query
青稞酒是白酒/蒸馏酒吗？,knowledge_query
什么是清香型白酒？,knowledge_query
天佑德青稞酒捐资助学项目的公益文化是什么？,knowledge_query
为什么青稞酒离不开互助县？,knowledge_query
关于青海天佑德科技投资管理集团的介绍,knowledge_query
青海天佑德科技投资管理集团的五大业务板块分别是什么？,knowledge_query
青海天佑德科技投资管理集团中的“两院一校”分别是什么,knowledge_query
天佑德青稞酒面对未来发展是如何规划的？,knowledge_query
天佑德青稞酒公司生产能力,knowledge_query
马克斯威酒庄介绍,knowledge_query
天佑德青稞酒公司主要发展历程,knowledge_query
天佑德青稞酒的四美战略是什么意思,knowledge_query
天佑德未来发展会越来越好吗？,knowledge_query
美国的酒类TTB认证是怎么回事？,knowledge_query
天佑德主要获得的企业荣誉有哪些？,knowledge_query
芝麻香型白酒的特点是什么,knowledge_query
班彦村村民利用盘绣赚钱,knowledge_query
坚持以德青稞酒为核心发展,knowledge_query
天佑德青稞酒的特点是什么,knowledge_query
清香白酒的颜色如何,knowledge_query
土族纳顿节的含义是什么,knowledge_query
青稞酒与其他香型白酒有什么差别？,knowledge_query
青稞酒中有哪些是其他清香型白酒没有的优势？,knowledge_query
什么叫原浆酒？,knowledge_query
白酒酿酒过程中“掐头去尾”什么意思？,knowledge_query
什么是特曲酒、头曲酒、二曲酒、大曲酒、小曲酒？,knowledge_query
什么是勾兑？,knowledge_query
青稞酒是勾兑的吗？,knowledge_query
青稞酒是用酒精勾兑的吗？,knowledge_query
白酒喝了上头是什么原因？,knowledge_query
喝白酒为什么会有头晕的现象？,knowledge_query
高度白酒是不是比低度的白酒质量好？,knowledge_query
好酒源于好原料吗？,knowledge_query
纯粮酿造的酒就一定是好酒吗？,knowledge_query
天佑德青稞酒公司企业文化中青藏文化信仰如何理解？,knowledge_query
天佑德青稞酒公司企业文化中青稞精神如何理解？,knowledge_query
阿拉嘉宝是什么意思,knowledge_query
青海的酸奶有什么不一样,knowledge_query
天佑德青稞酒的特点是什么？,knowledge_query
目前天佑德青稞酒原酒储量多少？,knowledge_query
互助土族传统节日有什么？,knowledge_query
回族习俗的有哪些？,knowledge_query
为什么说“互助县之于青稞酒”就像“茅台镇之于茅台酒”？,knowledge_query
互助土族风俗习惯,knowledge_query
雍布拉康,knowledge_query
小黑青稞酒,knowledge_query
具有独特特点,knowledge_query
白酒窖池采用何种香型,knowledge_query
AI数字虚拟人的优势是什么,knowledge_query
请介绍青稞酒的酿造工艺s,knowledge_query
土族的饮食禁忌是什么,knowledge_query
青稞酒为什么喝了不上头、口不干、醒酒快？,knowledge_query
青稞酒带有微黄色正常吗？,knowledge_query
青稞酒是真正的有机产品吗？,knowledge_query
青稞酒加水浑浊吗？,knowledge_query
青稞酒能不能长时间存放，是不是存放时间越长酒质越好？,knowledge_query
青稞酒有保质期吗？,knowledge_query
青稞酒添加甜味剂了吗？,knowledge_query
青稞酒为什么入口有点冲（chong四声）辣？,knowledge_query
小酒厂的青稞酒和你们的青稞酒有什么区别？,knowledge_query
如何正确的品评青稞酒？,knowledge_query
青稞酒入口后的后味如何？,knowledge_query
青稞酒怎么喝更舒服？,knowledge_query
为什么青稞酒饮用前要温酒？,knowledge_query
为什么不同价位青稞酒口味不同？,knowledge_query
青稞酒的曲香味是怎么来的？,knowledge_query
纯粮固态发酵法和固液法、结合法酿的酒有什么不同？,knowledge_query
固态法白酒是什么意思？,knowledge_query
液态法白酒是什么意思？,knowledge_query
固液法白酒是什么意思？,knowledge_query
新酒和老酒怎么区分？,knowledge_query
白酒挂杯越明显越是好酒吗？,knowledge_query
酒瓶上GB/T10781.2是什么意思？,knowledge_query
酒瓶上GB/T19331是什么意思？,knowledge_query
青稞中的健康成分会进入到青稞酒中吗？,knowledge_query
青稞酒中检测出了哪些微量成分？,knowledge_query
掐头去尾蒸酒时截除酒头和酒尾,knowledge_query
雍布拉康的含义,knowledge_query
固液法白酒的定义是什么,knowledge_query
青稞种植地点,knowledge_query
青海湖交通情况,knowledge_query
白酒豉香型的酿造工艺,knowledge_query
岩木合一的定义是什么,knowledge_query
十大特产,knowledge_query
天佑德青稞酒因其源自中国青稞酒而得名,knowledge_query
咨询关于旅行,knowledge_query
茶卡盐湖形成原因地质活动干旱气候和盐水浸蚀,knowledge_query
为何在互助西宁西藏均可见,knowledge_query
有无青稞酒的特别之处,knowledge_query
土族人特点,knowledge_query
去除不适合酿酒的部分,knowledge_query
公司青稞酒有哪些种类,knowledge_query
酱香型白酒的生产工艺分类有哪几种,knowledge_query
青稞酒低温入窖的原因是什么,knowledge_query
青稞酒怎么样推荐,knowledge_query
简洁表达对青稞酒的看法和推荐,knowledge_query
青稞丰收节是什么庆祝方式是怎样的,knowledge_query
酒瓶上的GB/T19331表示何含义,knowledge_query
了解天佑德青稞酒公司资讯的渠道是什么,knowledge_query
兼具香味特点的白酒,knowledge_query
土族婚礼的部分,knowledge_query
青稞酒大曲中的豌豆作用是什么,knowledge_query
出口型简介,knowledge_query
夏琼寺,knowledge_query
白马寺,knowledge_query
大佛寺,knowledge_query
互助北山国家森林公园面积多大？,knowledge_query
互助北山国家森林公园地理位置？,knowledge_query
互助北山公园由哪些景区组成 ？,knowledge_query
互助北山国家森林公园主要有哪些景点？,knowledge_query
互助十二盘的由来？,knowledge_query
互助北山景区获得了哪些荣誉？,knowledge_query
互助北山独特优势有哪些？,knowledge_query
互助北山公园的最佳参观时间？,knowledge_query
互助北山有哪些动植物种类？,knowledge_query
互助北山“圣母天池”简介？,knowledge_query
互助土族妇女服饰有哪些颜色？,knowledge_query
土族语言和文字与汉族有什么区别？,knowledge_query
土族与土家族的有什么区别？,knowledge_query
土族饮食习惯,knowledge_query
三木德是谁,knowledge_query
米香型白酒工艺流程？,knowledge_query
米香型白酒的发酵设备、周期及储藏容器？,knowledge_query
米香型白酒的小曲制作原料及特点？,knowledge_query
什么是小曲固态法白酒？,knowledge_query
什么是兼香型白酒？,knowledge_query
兼香型白酒采用什么大曲？,knowledge_query
兼香型白酒采用什么原料酿酒？,knowledge_query
兼香型白酒采用什么窖池？,knowledge_query
什么是凤香型白酒，代表产品是什么？,knowledge_query
青海省互助县概况,knowledge_query
互助县标志性建筑——鼓楼介绍,knowledge_query
互助县区域内的寺庙有哪些,knowledge_query
互助的特产有哪些？,knowledge_query
互助“花儿”是什么？,knowledge_query
门源县名字的由来。,knowledge_query
门源百里油菜花景区介绍,knowledge_query
门源的地方风俗。,knowledge_query
背口袋,knowledge_query
凤香型白酒的起源与文化？,knowledge_query
凤香型白酒产地在哪里？,knowledge_query
酿酒酵母的作用是发酵酒精,knowledge_query
Tianyoude Qingkejiu Company's purpose is,knowledge_query
凤香型白酒酿造原料什么？,knowledge_query
凤香型白酒制曲原料是什么？,knowledge_query
凤香型白酒发酵设备是什么？,knowledge_query
凤香型白酒风格特征是什么？,knowledge_query
凤香型白酒的存储与勾调？,knowledge_query
凤香型白酒的执行标准是什么？,knowledge_query
什么是芝麻香型白酒？,knowledge_query
芝麻香型白酒的代表产品有哪些？,knowledge_query
芝麻香型的酿造工艺？,knowledge_query
芝麻香型白酒的酒质特点？,knowledge_query
芝麻香型白酒所用的发酵窖池？,knowledge_query
Advice on choosing Tianyoude Highland Barley Liquor,knowledge_query
青稞酒存放时间对酒质有影响吗能改善酒质吗,knowledge_query
芝麻香型白酒的酿酒原料？,knowledge_query
芝麻香型白酒的认定时间与地点？,knowledge_query
芝麻香型白酒所用的发酵窖池有什么特点？,knowledge_query
芝麻香型白酒的原料中为什么要加入小麦和麸皮？,knowledge_query
什么是豉香型白酒？,knowledge_query
豉香型白酒的特点？,knowledge_query
豉香型白酒的酿酒原料？,knowledge_query
豉香型白酒采用什么曲？,knowledge_query
豉香型白酒的酿造工艺？,knowledge_query
豉香型白酒的生产工艺流程？,knowledge_query
豉香型白酒采用什么容器发酵？,knowledge_query
青稞酒好喝吗有没有推荐,knowledge_query
酿酒菌的来源在哪,knowledge_query
青稞酒的主要成分是什么,knowledge_query
德青稞酒公司服务热线多少,knowledge_query
汾酒特点清香型白酒,knowledge_query
豉香型白酒的原料是豉或以其为主的发酵物,knowledge_query
适合何种场合饮用,knowledge_query
德青稞酒企业文化中的青稞信仰的涵义是什么,knowledge_query
请介绍天佑德青稞酒公司的产品,knowledge_query
天佑德青稞酒公司是做酒业的,knowledge_query
互助特产有哪些,knowledge_query
不能用燕麦或荞麦替代,knowledge_query
豉香型白酒是指带有豆豉的风味的白酒,knowledge_query
茶卡盐湖被誉为天空之境的原因是什么,knowledge_query
推荐几款100以内的青稞酒,knowledge_query
了解公司青稞酒的种类,knowledge_query
天佑德出口海外了吗,knowledge_query
请介绍天佑德青稞酒公司的产品,knowledge_query
“清蒸清烧四次清”是一道烹饪方法吗,knowledge_query
你们的青稞酒销售渠道是怎样的,knowledge_query
药香型白酒的成分是什么,knowledge_query
藏族的礼仪有什么？,knowledge_query
藏族传统节日有哪些？,knowledge_query
青稞酒有什么文学著作或资料吗？,knowledge_query
湟源陈醋又是啥？,knowledge_query
雍布拉康是什么意思？,knowledge_query
什么是发酵？,knowledge_query
天佑德青稞酒公司上市以后看不见酒糟、闻不见酒香，外界传言现在生产的酒都是勾兑的，这是真的吗？,knowledge_query
酿造产生的酒糟都去了哪里？,knowledge_query
介绍介绍拉萨,knowledge_query
丢糟子时营养物质全部利用掉了吗？,knowledge_query
热贡唐卡？,knowledge_query
西藏的宗教,knowledge_query
能详细解释一下吗,knowledge_query
兼香型白酒的代表产品是哪些,knowledge_query
OpenAI 制作 GPT-3 是为了令人惊叹的语言生成能力,knowledge_query
青稞酒相较高粱酒有何不同,knowledge_query
馥郁香型白酒的代表产品是什么,knowledge_query
浓香型白酒的特点是香气浓郁,knowledge_query
GB/T19331是一种标准,knowledge_query
青稞酒窖池底部铺松木板的作用是什么,knowledge_query
慕容拾寅,knowledge_query
故事概述,knowledge_query
你是在广袤的青稞田间出生的吗,knowledge_query
茶卡盐湖面积是多少-> 茶卡盐湖的面积是多少,knowledge_query
李灵儿的虚拟身份有何特殊技能或功能,knowledge_query
白酒中香味浓郁,knowledge_query
请介绍天佑德青稞酒的特色,knowledge_query
平常你推荐过哪些好酒,knowledge_query
茶卡盐湖位于哪个城市省,knowledge_query
勾兑是指混合不同的物质或液体,knowledge_query
每年消耗青稞量,knowledge_query
有何特殊功能或技能,knowledge_query
老白干香型白酒是一种什么样的酒,knowledge_query
天佑德青稞酒的生产特色是什么,knowledge_query
酿酒中的霉菌的作用是什么,knowledge_query
介绍七彩互助青稞酒,knowledge_query
天佑德青稞酒酿造技艺中清蒸清烧四次清具体是怎么理解的？,knowledge_query
什么是天酿工艺？,knowledge_query
“清蒸清烧四次清”工艺和天酿工艺有什么不同？,knowledge_query
天佑德青稞酒酿酒菌来自哪里呢？,knowledge_query
藏族主要居住地是什么？,knowledge_query
新酒和老酒怎么区分？,knowledge_query
手抓羊肉怎么做的,knowledge_query
酿酒原料青稞质量是怎么保障的？,knowledge_query
什么是酒海,knowledge_query
日月山景区介绍,knowledge_query
天佑德青稞酒为什么被称为“中国青稞酒之源”？,knowledge_query
青海历史文化,knowledge_query
天佑德青稞酒是国家非遗吗？,knowledge_query
甜醅是什么？,knowledge_query
天人合一的酿酒哲学是什么？,knowledge_query
明朝著名历史人物刘敏宽和青稞酒有什么联系？,knowledge_query
天佑德除了青稞酒以外，还有其他的青稞衍生产品吗？,knowledge_query
“散酒有品牌，就喝世义德”，那么世义德和其他散酒有什么区别？,knowledge_query
西藏的酒文化,knowledge_query
回族有哪些忌讳？,knowledge_query
那曲地区是指哪里？,knowledge_query
现在市面上有很多的假酒，怎么区分真假呢？,knowledge_query
面对全国市场及天佑德品牌的发展，天佑德以什么产品作为代表？,knowledge_query
天佑德青稞酒获得过哪些奖项呢？,knowledge_query
天佑德出口到海外了吗？,knowledge_query
推荐天佑德青稞酒的产品有哪些,knowledge_query
青稞酒与其他香型白酒的区别,knowledge_query
三江源,knowledge_query
青稞酒与什么美食搭配更合适？,knowledge_query
青稞酒研究院,knowledge_query
轮子秋是什么意思?,knowledge_query
天佑德威士忌是在哪里产的？,knowledge_query
茶卡盐湖,knowledge_query
青稞酒温酒文化是怎么形成的？,knowledge_query
青稞酒有什么特殊的喝酒仪式吗？,knowledge_query
介绍一下门源奶皮,knowledge_query
白酒挂杯越明显越是好酒吗？,knowledge_query
藏餐文化,knowledge_query
土族习俗是什么？,knowledge_query
酒瓶上GB/T10781.2是什么意思？,knowledge_query
西藏象雄古国和苯教是什么意思？,knowledge_query
酥油茶,knowledge_query
甜茶,knowledge_query
糌粑,knowledge_query
藏面,knowledge_query
青稞蛋酥,knowledge_query
牦牛酸奶,knowledge_query
牦牛肉干,knowledge_query
鲁朗石锅鸡,knowledge_query
牦牛火锅,knowledge_query
烤羊藏餐,knowledge_query
纳木措,knowledge_query
羊卓雍措,knowledge_query
玛旁雍措,knowledge_query
拉姆拉措,knowledge_query
我也喜欢尝试青稞酒是什么,knowledge_query
馥郁香型白酒酿造工艺是什么,knowledge_query
馥郁香型白酒储存及风格特点？,knowledge_query
什么是老白干香型白酒？,knowledge_query
老白干香型白酒的工艺特点是什么？,knowledge_query
老白干香型的酿造工艺是什么？,knowledge_query
老白干香型与其他白酒香型的区别是什么？,knowledge_query
老白干香型白酒的贮存容器？,knowledge_query
老白干香型白酒的香味成分特点及风味特征？,knowledge_query
互助牌老字号 普标,knowledge_query
互助牌老字号 金标,knowledge_query
海拔2800,knowledge_query
海拔3200,knowledge_query
海拔3800,knowledge_query
海拔4600,knowledge_query
天宝,knowledge_query
金宝,knowledge_query
你能给我推荐几款高端的青稞酒吗？,knowledge_query
你能给我推荐几款中档价位段的青稞酒吗？,knowledge_query
你能给我推荐几款100元以内的青稞酒吗？,knowledge_query
八大作坊,knowledge_query
天佑德青稞酒公司官方服务热线是多少？,knowledge_query
天佑德青稞酒公司企业管理战略是什么？,knowledge_query
天佑德青稞酒公司的负责人是谁？,knowledge_query
分享天佑德青稞酒的优点,knowledge_query
固态法白酒的定义是什么,knowledge_query
彩宝,knowledge_query
生态五星20版,knowledge_query
生态四星20版,knowledge_query
第三代出口型国际版,knowledge_query
岩窖20,knowledge_query
出口型系列52°,knowledge_query
生态五星,knowledge_query
生态四星,knowledge_query
生态三星,knowledge_query
新品活动,knowledge_query
保证青稞酒酿造过程,knowledge_query
青稞酿酒质量如何保证,knowledge_query
纯粮固态固液和结合发酵酿造的酒有何差异如何区分它们,knowledge_query
浓香型白酒的代表品牌是什么,knowledge_query
青稞酒的历史与特点是什么,knowledge_query
白霜满天星曲是什么,knowledge_query
酿造产生的酒糟去哪里了,knowledge_query
请告诉我青稞酒的酿造过程,knowledge_query
米香型白酒原料和用水是什么,knowledge_query
对青稞美酒和青藏高原的独特见解是什么,knowledge_query
青稞酒配槐瓤曲白霜满天星曲作用,knowledge_query
原子城历史文化意义(重要作用)是什么,knowledge_query
开耕节人们会耕种农田或进行传统农耕活动,knowledge_query
单粮型浓香型白酒是仅使用一种原料制成的浓郁香醇的白酒,knowledge_query
青稞酒的销售渠道是什么,knowledge_query
请介绍福酒,knowledge_query
白酒串蒸工艺是指利用药香来蒸制白酒的一种方法,knowledge_query
介绍海拔系列,knowledge_query
天佑德威士忌产地,knowledge_query
检测塑化剂指标,knowledge_query
酒越好,knowledge_query
传承独特,knowledge_query
“两小一大”是判断蒸酒是否符合要求的依据,knowledge_query
天佑德青稞酒的大曲特点是什么,knowledge_query
具体是怎么操作的,knowledge_query
凤香型白酒的储存和调配方法,knowledge_query
创造力是一种突然冒出的灵感和新点子,knowledge_query
酒精度的高低与肝损伤之间有关系吗？,knowledge_query
白酒喝多少对人体不会造成伤害？,knowledge_query
青稞酒从原料到出厂一共经过了多少道检验？,knowledge_query
青稞酒酿造对青稞原料都有哪些要求？,knowledge_query
如何保证青稞酒的酿造过程？,knowledge_query
不同批次的同一款青稞酒质量完全一样吗？,knowledge_query
天佑德青稞酒采用了多少个检测标准？,knowledge_query
天佑德青稞酒原始检测记录保存年限是多长？,knowledge_query
青稞酒的骨架成分是什么？,knowledge_query
什么是国家地理标志产品？,knowledge_query
听说互助青稞酒是国家地理标志产品？,knowledge_query
天佑德品牌历史,knowledge_query
天佑德青稞酒的历史,knowledge_query
天佑德青稞酒的发展历程,knowledge_query
天佑德青稞酒的发展历史,knowledge_query
酱香型白酒窖池有哪些,knowledge_query
青稞酒生产有何独特之处,knowledge_query
青稞酒的特点如何,knowledge_query
土族的饮食习惯有哪些？,knowledge_query
品牌成立多久,knowledge_query
天佑德青稞酒的历史是什么,knowledge_query
天佑德青稞酒的发展历程是什么,knowledge_query
土族饮食禁忌有哪些？,knowledge_query
土族的丧葬实行哪种仪式？,knowledge_query
土族人家有什么特点？,knowledge_query
土族盘绣有哪些图案？,knowledge_query
土族婚礼有哪几个部分？,knowledge_query
土族纳顿节是什么意思？,knowledge_query
茶卡盐湖的旅游资源什么时候开发的？,knowledge_query
茶卡盐湖位于哪个城市，哪个省？,knowledge_query
茶卡盐湖面积是多少？,knowledge_query
茶卡盐湖的盐和普通盐的区别？,knowledge_query
土族盘绣图案有哪些,knowledge_query
推荐款特别好的天佑德青稞酒给我,knowledge_query
原子城景区介绍,knowledge_query
历史上有哪些人为青稞酒的发展做了哪些贡献呢？,knowledge_query
金禅酒祖是谁？,knowledge_query
伊尹是谁？,knowledge_query
无弋爰剑是谁？,knowledge_query
互助土族故土园,knowledge_query
黑马河景区介绍,knowledge_query
赵充国是谁？,knowledge_query
慕容拾寅是谁？,knowledge_query
什么是柴达木枸杞,knowledge_query
介绍李银会,knowledge_query
文成公主是谁？,knowledge_query
青藏高原相关歌曲,knowledge_query
藏族饮酒的礼仪和习俗,knowledge_query
讲一讲昌都,knowledge_query
今天的温度怎么样,knowledge_query
杯中酒挂的量越多越好吗,knowledge_query
青稞酒发展中的贡献者是谁,knowledge_query
青稞酒品牌特点工艺文化,knowledge_query
品牌特点工艺文化,knowledge_query
北山公园最佳参观时间是什么,knowledge_query
青稞酒与普通酒有什么不同,knowledge_query
青海的旅游发展战略环线路三条线路,knowledge_query
Qingkejiu's sales performance in the market,knowledge_query
青稞酒的特点是什么,knowledge_query
天佑德的大曲是自制的原因不能外购大曲的原因,knowledge_query
芝麻香型白酒的酿酒原料是什么,knowledge_query
伊尹的身份和他的故事是什么,knowledge_query
简洁表达伊尹是谁他的故事是什么,knowledge_query
天佑德酒厂能酿造的原因是什么,knowledge_query
酿造的原因是什么,knowledge_query
天佑德青稞酒包装车间简介,knowledge_query
瓷坛储存的原因是什么,knowledge_query
《青稞香型白酒》的标准是什么,knowledge_query
研发产品考虑价位区域系列是哪些,knowledge_query
原酒配比调味量有什么不同,knowledge_query
什么是《青稞香型白酒》标准？,knowledge_query
青稞酒酿造所用的青稞原料有哪些品种？,knowledge_query
公司生产的橡木青稞酒属于白酒还是威士忌？,knowledge_query
青稞酒是否存在铅含量超标？,knowledge_query
青稞酒中农残超标吗？,knowledge_query
什么是第一方、第二方和第三方实验室？,knowledge_query
公司检测中心是何时通过 CNAS 认可的？,knowledge_query
天佑德青稞酒公司的检测中心获得过什么荣誉？,knowledge_query
请介绍下天游德高粱酒公司的故事,knowledge_query
互助十二盘是什么,knowledge_query
行业影响力大吗,knowledge_query
青稞酒的酿造过程能告诉我吗,knowledge_query
你对青稞美酒和青藏高原有何见解,knowledge_query
格日勒特是谁,knowledge_query
格日勒特有什么故事,knowledge_query
格日勒特的经历或事件,knowledge_query
国之德的含义和作用能否介绍一下,knowledge_query
青稞品种有多少,knowledge_query
什么是通天河,knowledge_query
酒瓶上GB/T19331是什么意思？,knowledge_query
水为酒之血，天佑德青稞酒酿造用水来自哪里呢？,knowledge_query
其他酒厂在夏季会停产，而天佑德酒厂也能在夏季酿造，是什么原因呢？,knowledge_query
你给我推荐几个天佑德的产品吧？,knowledge_query
介绍西藏藏红花,knowledge_query
阿里地区,knowledge_query
西藏那曲冬虫夏草,knowledge_query
你能给我介绍一下天之德吗？,knowledge_query
阿咪东索景区介绍,knowledge_query
你能给我介绍一下国之德吗？,knowledge_query
西藏特产及特色美食,knowledge_query
牦牛肉是什么,knowledge_query
芝麻香型白酒的代表产品有哪些,knowledge_query
酒精度高与肝损伤有关吗,knowledge_query
盐卤的来源造成了茶卡盐和普通盐的区别,knowledge_query
天佑德青稞酒有没有检测塑化剂指标？,knowledge_query
标签标示的配料表中的物料是随意排列？,knowledge_query
天佑德技术中心通过了企业技术中心认证了吗？,knowledge_query
企业技术中心有什么作用？,knowledge_query
天佑德技术中心有多少专家人才？,knowledge_query
天佑德技术中心和外面哪些研究单位有合作？,knowledge_query
天佑德技术中心专家委员会有什么作用？,knowledge_query
狗浇尿,knowledge_query
酸奶,knowledge_query
甜醅,knowledge_query
土火锅,knowledge_query
尕面片,knowledge_query
熬饭,knowledge_query
手抓羊肉,knowledge_query
牛肉干,knowledge_query
青海烤羊肉：,knowledge_query
糌粑：,knowledge_query
黑枸杞：,knowledge_query
青稞酒：,knowledge_query
无弋爰剑是谁？,knowledge_query
北山国家森林公园位置在哪,knowledge_query
伊尹是谁？有什么故事？,knowledge_query
开耕节仪式有哪些,knowledge_query
三木德,knowledge_query
发酵是微生物在无氧条件下分解有机物的过程糖化是将淀粉转化为糖的过程,knowledge_query
刘敏宽,knowledge_query
山西白酒技术,knowledge_query
山西白酒技术有什么优势,knowledge_query
天佑德有其他青稞产品吗,knowledge_query
什么是八大作坊？,knowledge_query
评价大曲质量考虑口感香气酒体等方面综合评定,knowledge_query
大曲与小曲有何区别,knowledge_query
青稞酒的发展传承及阶段概述,knowledge_query
赵长基是谁？有什么故事？,knowledge_query
你的工作地点在哪,knowledge_query
天佑德青稞酒公司历史简介,knowledge_query
凤香型白酒发酵设备是什么,knowledge_query
简洁表达白酒发酵设备的定义/特点/作用,knowledge_query
天佑德青稞酒是什么品牌,knowledge_query
